{
  "@context": {
    "@version": 1.1,
    "gic": "https://sustainablecatalyst.com/ns/global-impact-catalyst/",
    "schema": "https://schema.org/",
    "dcterms": "http://purl.org/dc/terms/",
    "prov": "http://www.w3.org/ns/prov#",
    "sdg": "https://metadata.un.org/sdg/",
    "id": "@id",
    "type": "@type",
    "name": "schema:name",
    "description": "schema:description",
    "datePublished": "schema:datePublished",
    "measurementTechnique": "schema:measurementTechnique",
    "variableMeasured": "schema:variableMeasured",
    "isBasedOn": {
      "@id": "schema:isBasedOn",
      "@type": "@id"
    },
    "wasDerivedFrom": {
      "@id": "prov:wasDerivedFrom",
      "@type": "@id"
    }
  },
  "api_version": "v1",
  "data": {
    "publication": {
      "publication_id": "gic-publication-ec04100f2b2b57e4c8dc",
      "title": "Public Impact Profile",
      "release_label": "2026 Q2",
      "public_url": "",
      "published_at": "2026-07-17T23:05:23.653944+00:00",
      "content_hash": "cafe060d576c29e243d80351c787a0baee357568e370412c6270708204316f3f"
    },
    "snapshot": {
      "snapshot_id": "gic-publication-snapshot-6aa5f90607ee15307436",
      "snapshot_hash": "84dcfa35d10048efbcaf5e83e0c7a245a0b16e2b8f3d5c630d1c944daa1d0749",
      "source_hashes": {
        "contract_hash": "dea5c17a7595056e50a467f4f64116b55212f09dbf18100c342f9e908850638f",
        "evidence_hash": "6cae05a2b22e96efaa8eb16d5b75f8df0508b151af6051139e81e3a327e9c3bc",
        "registry_hash": "2d4928efb622d247b11a8949fc2e6c94b3c45c385757bf474f6bb1563a223ad5",
        "measurement_hash": "6d3b6f85a1f48ab9d8594f72deee1f54b96247f0aee2c039f08786138b191578",
        "review_hash": "47d218a47c7237d6647f597ffbd79f79dc5e68f800acb98821c7dbdbbf184948",
        "analysis_hash": "4bd9e1d29571630bdd31a616b435f77ac7c664c11ab07190f49c09ee08744e4e",
        "report_hash": "91af824d54b5349ff130a92433af11934c9b5fe9fede760043553247012295c1"
      }
    },
    "initiative": {
      "id": "gic-initiative-09a657f60923ed45",
      "name": "Community Energy Retrofit Pilot",
      "description": "",
      "goal": "Reduce household energy burden while improving residential efficiency.",
      "outcomes": [
        {
          "id": "gic-outcome-5dfda192c94fd5fb",
          "statement": "Participating households experience lower monthly energy costs."
        }
      ],
      "geography": {
        "name": "",
        "type": ""
      },
      "indicator": {
        "id": "gic-indicator-2e7a8f93231487ce",
        "name": "Average monthly bill reduction",
        "definition": "",
        "direction": ""
      },
      "latest_observation": {
        "value": 18.0,
        "unit": "USD",
        "period": {
          "label": "2026 Q2"
        }
      },
      "baseline": {
        "created_at": "2026-07-17T23:00:00+00:00",
        "entity_type": "baseline",
        "id": "gic-baseline-bccde48f17ee3898",
        "indicator_id": "gic-indicator-2e7a8f93231487ce",
        "method_id": "gic-method-dfc0b951aac86076",
        "period": {
          "label": "2025 baseline"
        },
        "source_ids": [
          "gic-source-f2284ef9ae098b56"
        ],
        "unit": "USD",
        "updated_at": "2026-07-17T23:00:00+00:00",
        "value": 0.0
      },
      "target": {
        "created_at": "2026-07-17T23:00:00+00:00",
        "direction": "higher_is_better",
        "entity_type": "target",
        "id": "gic-target-61bc37e9887a3252",
        "indicator_id": "gic-indicator-2e7a8f93231487ce",
        "period": {
          "label": "2027"
        },
        "unit": "USD",
        "updated_at": "2026-07-17T23:00:00+00:00",
        "value": 30.0
      },
      "derived": {
        "metrics": {
          "absolute_change": 18.0,
          "calculation_method": {
            "engine": "global-impact-catalyst",
            "engine_version": "1.1.0",
            "progress_formula": "direction-aware change from baseline divided by baseline-to-target distance",
            "rounding": "decimal half up"
          },
          "cost_per_beneficiary": {
            "currency": "USD",
            "value": 297.62
          },
          "data_quality_components": {
            "confidence_signal": 15,
            "method_documented": 25,
            "review_signal": 10,
            "source_documented": 25
          },
          "data_quality_score": 75,
          "percent_change_from_baseline": null,
          "progress_to_target_percent": 60.0,
          "remaining_gap": 12.0,
          "status": "draft — partial progress"
        },
        "interpretation": {}
      },
      "contract_version": "1.1.0"
    },
    "report": {
      "report_id": "gic-report-33effbb428568840db6a",
      "title": "Public Impact Report",
      "report_type": "impact_report",
      "audience": "public",
      "period_label": "2026 Q2",
      "content_hash": "91af824d54b5349ff130a92433af11934c9b5fe9fede760043553247012295c1",
      "document": {
        "analysis_summary": {
          "analysis_run_count": 0,
          "benchmark_count": 0,
          "comparison_member_count": 0,
          "comparison_set_count": 0,
          "orphan_comparison_member_ids": [],
          "orphan_sensitivity_run_ids": [],
          "scenario_count": 0,
          "sensitivity_run_count": 0,
          "uncertainty_model_count": 0,
          "valid": true
        },
        "audience": "public",
        "citations": [
          {
            "creator": "Unknown author",
            "formatted": "Unknown author (n.d.) Pilot utility-billing sample and participant survey summary. Internal pilot evidence package GIC-ENERGY-2026-Q2",
            "locator": "Internal pilot evidence package GIC-ENERGY-2026-Q2",
            "publisher": "",
            "source_id": "gic-source-f2284ef9ae098b56",
            "title": "Pilot utility-billing sample and participant survey summary",
            "year": "n.d."
          }
        ],
        "evidence_summary": {
          "claim_link_count": 0,
          "contradicting_link_count": 0,
          "dataset_count": 0,
          "edge_count": 9,
          "evidence_count": 0,
          "missing_checksum_source_ids": [],
          "orphan_claim_evidence_links": [],
          "source_count": 1,
          "valid": true,
          "version_count": 1
        },
        "executive_summary": "Community Energy Retrofit Pilot reports governed impact evidence for 2026 Q2.",
        "goal": "Reduce household energy burden while improving residential efficiency.",
        "indicator": {
          "baseline": {
            "created_at": "2026-07-17T23:00:00+00:00",
            "entity_type": "baseline",
            "id": "gic-baseline-bccde48f17ee3898",
            "indicator_id": "gic-indicator-2e7a8f93231487ce",
            "method_id": "gic-method-dfc0b951aac86076",
            "period": {
              "label": "2025 baseline"
            },
            "source_ids": [
              "gic-source-f2284ef9ae098b56"
            ],
            "unit": "USD",
            "updated_at": "2026-07-17T23:00:00+00:00",
            "value": 0.0
          },
          "name": "Average monthly bill reduction",
          "observed_value": 18.0,
          "period": {
            "label": "2026 Q2"
          },
          "target": {
            "created_at": "2026-07-17T23:00:00+00:00",
            "direction": "higher_is_better",
            "entity_type": "target",
            "id": "gic-target-61bc37e9887a3252",
            "indicator_id": "gic-indicator-2e7a8f93231487ce",
            "period": {
              "label": "2027"
            },
            "unit": "USD",
            "updated_at": "2026-07-17T23:00:00+00:00",
            "value": 30.0
          },
          "unit": "USD"
        },
        "initiative": {
          "id": "gic-initiative-09a657f60923ed45",
          "name": "Community Energy Retrofit Pilot"
        },
        "interpretation": {},
        "language": "en",
        "limitations": [
          "Validation tests consistency and traceability, not truth or source authenticity.",
          "Observed change does not by itself establish attribution or causality.",
          "Scenario and trend outputs are descriptive or planning artifacts, not verified forecasts."
        ],
        "methodology": {
          "analysis_repository_version": "1.7.0",
          "boundary": "",
          "calculation_provenance": {},
          "canonical_contract_version": "1.1.0",
          "evidence_repository_version": "1.3.0",
          "indicator_registry_version": "1.4.0",
          "measurement_repository_version": "1.5.0",
          "method_count": 1,
          "review_workflow_version": "1.6.0",
          "source_count": 1
        },
        "metrics": {
          "absolute_change": 18.0,
          "calculation_method": {
            "engine": "global-impact-catalyst",
            "engine_version": "1.1.0",
            "progress_formula": "direction-aware change from baseline divided by baseline-to-target distance",
            "rounding": "decimal half up"
          },
          "cost_per_beneficiary": {
            "currency": "USD",
            "value": 297.62
          },
          "data_quality_components": {
            "confidence_signal": 15,
            "method_documented": 25,
            "review_signal": 10,
            "source_documented": 25
          },
          "data_quality_score": 75,
          "percent_change_from_baseline": null,
          "progress_to_target_percent": 60.0,
          "remaining_gap": 12.0,
          "status": "draft — partial progress"
        },
        "outcomes": [
          {
            "created_at": "2026-07-17T23:00:00+00:00",
            "entity_type": "outcome",
            "goal_id": "gic-goal-ece2bacb67a2be38",
            "id": "gic-outcome-5dfda192c94fd5fb",
            "statement": "Participating households experience lower monthly energy costs.",
            "updated_at": "2026-07-17T23:00:00+00:00"
          }
        ],